{
  "schema_version": 2,
  "id": "lekiwi",
  "name": "LeKiwi 移动底盘 + 臂",
  "name_en": "LeKiwi Mobile Base + Arm",
  "kind": "mobile_arm",
  "dof": 9,
  "bus": [
    "feetech"
  ],
  "support_status": "planned",
  "lerobot_type": "lekiwi",
  "vendor": {
    "name": "SIGRobotics-UIUC",
    "url": "https://github.com/SIGRobotics-UIUC/LeKiwi"
  }
}
