{
  "schema_version": 2,
  "id": "hope_jr_arm",
  "name": "HopeJR 拟人臂",
  "name_en": "HopeJR Humanoid Arm",
  "kind": "arm",
  "dof": 7,
  "bus": [
    "feetech"
  ],
  "support_status": "planned",
  "lerobot_type": "hope_jr_arm",
  "vendor": {
    "name": "TheRobotStudio",
    "url": "https://github.com/TheRobotStudio/HopeJR"
  }
}
