{
  "schema_version": 2,
  "id": "rebot_b601_follower",
  "name": "reBot B601 从臂",
  "name_en": "reBot B601 Follower",
  "kind": "arm",
  "dof": 7,
  "bus": [
    "other"
  ],
  "support_status": "planned",
  "lerobot_type": "rebot_b601_follower",
  "vendor": {
    "name": "Seeed Studio",
    "url": "https://github.com/Seeed-Studio"
  }
}
